{
  "schema_version": "2.0",
  "test_id": "Diagnostic_Exam_2026",
  "test_name": "Diagnostic Exam 2026",
  "sections": {
    "english": {
      "name": "Reading and Writing",
      "modules": {
        "module_1": {
          "name": "Module 1",
          "question_count": 27
        },
        "module_b": {
          "name": "Module B",
          "question_count": 27
        }
      }
    },
    "math": {
      "name": "Math",
      "modules": {
        "module_1": {
          "name": "Module 1",
          "question_count": 22
        },
        "module_b": {
          "name": "Module B",
          "question_count": 22
        }
      }
    }
  },
  "total_questions": 98,
  "unassessed_or_underassessed_lessons": [
    "MATH_PROBABILITY",
    "MATH_STAT_CLAIMS"
  ],
  "metadata_notes": "Difficulty, question style, expected time, and the official answer key are not distributed with this template and are stored as null. The correct answer for every question must be supplied in the case input. Subskill IDs are coarse planning identifiers derived from the published lesson mapping; they are not official College Board or Kaplan subskill codes.",
  "questions": [
    {
      "section": "english",
      "module": "module_1",
      "question_number": 1,
      "lesson_id": "ENG_WORDS_IN_CONTEXT",
      "subskill_id": "vocabulary_in_context",
      "question_style": null,
      "difficulty": null,
      "expected_time_seconds": null,
      "correct_answer": null
    },
    {
      "section": "english",
      "module": "module_1",
      "question_number": 2,
      "lesson_id": "ENG_WORDS_IN_CONTEXT",
      "subskill_id": "vocabulary_in_context",
      "question_style": null,
      "difficulty": null,
      "expected_time_seconds": null,
      "correct_answer": null
    },
    {
      "section": "english",
      "module": "module_1",
      "question_number": 3,
      "lesson_id": "ENG_WORDS_IN_CONTEXT",
      "subskill_id": "vocabulary_in_context",
      "question_style": null,
      "difficulty": null,
      "expected_time_seconds": null,
      "correct_answer": null
    },
    {
      "section": "english",
      "module": "module_1",
      "question_number": 4,
      "lesson_id": "ENG_WORDS_IN_CONTEXT",
      "subskill_id": "vocabulary_in_context",
      "question_style": null,
      "difficulty": null,
      "expected_time_seconds": null,
      "correct_answer": null
    },
    {
      "section": "english",
      "module": "module_1",
      "question_number": 5,
      "lesson_id": "ENG_WORDS_IN_CONTEXT",
      "subskill_id": "vocabulary_in_context",
      "question_style": null,
      "difficulty": null,
      "expected_time_seconds": null,
      "correct_answer": null
    },
    {
      "section": "english",
      "module": "module_1",
      "question_number": 6,
      "lesson_id": "ENG_TEXT_STRUCTURE_PURPOSE",
      "subskill_id": "structure_and_purpose",
      "question_style": null,
      "difficulty": null,
      "expected_time_seconds": null,
      "correct_answer": null
    },
    {
      "section": "english",
      "module": "module_1",
      "question_number": 7,
      "lesson_id": "ENG_TEXT_STRUCTURE_PURPOSE",
      "subskill_id": "structure_and_purpose",
      "question_style": null,
      "difficulty": null,
      "expected_time_seconds": null,
      "correct_answer": null
    },
    {
      "section": "english",
      "module": "module_1",
      "question_number": 8,
      "lesson_id": "ENG_CENTRAL_IDEAS_DETAILS",
      "subskill_id": "central_ideas_details",
      "question_style": null,
      "difficulty": null,
      "expected_time_seconds": null,
      "correct_answer": null
    },
    {
      "section": "english",
      "module": "module_1",
      "question_number": 9,
      "lesson_id": "ENG_CENTRAL_IDEAS_DETAILS",
      "subskill_id": "central_ideas_details",
      "question_style": null,
      "difficulty": null,
      "expected_time_seconds": null,
      "correct_answer": null
    },
    {
      "section": "english",
      "module": "module_1",
      "question_number": 10,
      "lesson_id": "ENG_COMMAND_OF_EVIDENCE",
      "subskill_id": "textual_evidence",
      "question_style": null,
      "difficulty": null,
      "expected_time_seconds": null,
      "correct_answer": null
    },
    {
      "section": "english",
      "module": "module_1",
      "question_number": 11,
      "lesson_id": "ENG_COMMAND_OF_EVIDENCE",
      "subskill_id": "textual_evidence",
      "question_style": null,
      "difficulty": null,
      "expected_time_seconds": null,
      "correct_answer": null
    },
    {
      "section": "english",
      "module": "module_1",
      "question_number": 12,
      "lesson_id": "ENG_INFERENCES",
      "subskill_id": "logical_inference",
      "question_style": null,
      "difficulty": null,
      "expected_time_seconds": null,
      "correct_answer": null
    },
    {
      "section": "english",
      "module": "module_1",
      "question_number": 13,
      "lesson_id": "ENG_INFERENCES",
      "subskill_id": "logical_inference",
      "question_style": null,
      "difficulty": null,
      "expected_time_seconds": null,
      "correct_answer": null
    },
    {
      "section": "english",
      "module": "module_1",
      "question_number": 14,
      "lesson_id": "ENG_STANDARD_ENGLISH_CONVENTIONS",
      "subskill_id": "conventions_general",
      "question_style": null,
      "difficulty": null,
      "expected_time_seconds": null,
      "correct_answer": null
    },
    {
      "section": "english",
      "module": "module_1",
      "question_number": 15,
      "lesson_id": "ENG_STANDARD_ENGLISH_CONVENTIONS",
      "subskill_id": "conventions_general",
      "question_style": null,
      "difficulty": null,
      "expected_time_seconds": null,
      "correct_answer": null
    },
    {
      "section": "english",
      "module": "module_1",
      "question_number": 16,
      "lesson_id": "ENG_STANDARD_ENGLISH_CONVENTIONS",
      "subskill_id": "conventions_general",
      "question_style": null,
      "difficulty": null,
      "expected_time_seconds": null,
      "correct_answer": null
    },
    {
      "section": "english",
      "module": "module_1",
      "question_number": 17,
      "lesson_id": "ENG_STANDARD_ENGLISH_CONVENTIONS",
      "subskill_id": "conventions_general",
      "question_style": null,
      "difficulty": null,
      "expected_time_seconds": null,
      "correct_answer": null
    },
    {
      "section": "english",
      "module": "module_1",
      "question_number": 18,
      "lesson_id": "ENG_STANDARD_ENGLISH_CONVENTIONS",
      "subskill_id": "conventions_general",
      "question_style": null,
      "difficulty": null,
      "expected_time_seconds": null,
      "correct_answer": null
    },
    {
      "section": "english",
      "module": "module_1",
      "question_number": 19,
      "lesson_id": "ENG_STANDARD_ENGLISH_CONVENTIONS",
      "subskill_id": "conventions_general",
      "question_style": null,
      "difficulty": null,
      "expected_time_seconds": null,
      "correct_answer": null
    },
    {
      "section": "english",
      "module": "module_1",
      "question_number": 20,
      "lesson_id": "ENG_STANDARD_ENGLISH_CONVENTIONS",
      "subskill_id": "conventions_general",
      "question_style": null,
      "difficulty": null,
      "expected_time_seconds": null,
      "correct_answer": null
    },
    {
      "section": "english",
      "module": "module_1",
      "question_number": 21,
      "lesson_id": "ENG_TRANSITIONS",
      "subskill_id": "transition_selection",
      "question_style": null,
      "difficulty": null,
      "expected_time_seconds": null,
      "correct_answer": null
    },
    {
      "section": "english",
      "module": "module_1",
      "question_number": 22,
      "lesson_id": "ENG_TRANSITIONS",
      "subskill_id": "transition_selection",
      "question_style": null,
      "difficulty": null,
      "expected_time_seconds": null,
      "correct_answer": null
    },
    {
      "section": "english",
      "module": "module_1",
      "question_number": 23,
      "lesson_id": "ENG_RHETORICAL_SYNTHESIS",
      "subskill_id": "notes_synthesis",
      "question_style": null,
      "difficulty": null,
      "expected_time_seconds": null,
      "correct_answer": null
    },
    {
      "section": "english",
      "module": "module_1",
      "question_number": 24,
      "lesson_id": "ENG_RHETORICAL_SYNTHESIS",
      "subskill_id": "notes_synthesis",
      "question_style": null,
      "difficulty": null,
      "expected_time_seconds": null,
      "correct_answer": null
    },
    {
      "section": "english",
      "module": "module_1",
      "question_number": 25,
      "lesson_id": "ENG_RHETORICAL_SYNTHESIS",
      "subskill_id": "notes_synthesis",
      "question_style": null,
      "difficulty": null,
      "expected_time_seconds": null,
      "correct_answer": null
    },
    {
      "section": "english",
      "module": "module_1",
      "question_number": 26,
      "lesson_id": "ENG_RHETORICAL_SYNTHESIS",
      "subskill_id": "notes_synthesis",
      "question_style": null,
      "difficulty": null,
      "expected_time_seconds": null,
      "correct_answer": null
    },
    {
      "section": "english",
      "module": "module_1",
      "question_number": 27,
      "lesson_id": "ENG_RHETORICAL_SYNTHESIS",
      "subskill_id": "notes_synthesis",
      "question_style": null,
      "difficulty": null,
      "expected_time_seconds": null,
      "correct_answer": null
    },
    {
      "section": "english",
      "module": "module_b",
      "question_number": 1,
      "lesson_id": "ENG_WORDS_IN_CONTEXT",
      "subskill_id": "vocabulary_in_context",
      "question_style": null,
      "difficulty": null,
      "expected_time_seconds": null,
      "correct_answer": null
    },
    {
      "section": "english",
      "module": "module_b",
      "question_number": 2,
      "lesson_id": "ENG_WORDS_IN_CONTEXT",